Title,Authors,Published Date,Image,Description,Genre Categories,Subject Categories,Type
The Adventures of Augie March,Saul Bellow,1953,https://images.thegreatestbooks.org/71155ue5419til25s11cevxpr0ep,"""The Adventures of Augie March"" is a novel set in Chicago during the Great Depression. The story follows the life of Augie March, a poor but spirited boy growing up in a broken home, as he navigates his way through life. The narrative explores his various jobs, relationships, and adventures, as he constantly seeks his identity and place in the world. His journey is marked by a series of encounters with different people and experiences, each shaping him in unique ways.","Coming of age, Fiction, Literary Fiction, Picaresque, Social & Cultural Fiction","Adversity, Ambition, Family, Freedom, Friendship, Identity, Individualism, Society",Fiction
All the King's Men,Robert Penn Warren,1946,https://images.thegreatestbooks.org/zhpar9jknimgopmpiwbci8eyb33d,"""All the King's Men"" is a political drama that revolves around the rise and fall of a Southern governor, loosely based on Louisiana's Huey Long. The story is narrated by a journalist who becomes the governor's right-hand man, offering an inside perspective on the political machinations, corruption, and personal tragedies that accompany the governor's climb to power. The novel explores themes of power, corruption, and the moral consequences of political ambition.","Fiction, Literary Fiction, Political, Social & Cultural Fiction, Tragedy","Ambition, Betrayal, corruption, Friendship, Guilt, Idealism, morality, Politics, Power, Redemption, Southern Gothic",Fiction
American Pastoral,Philip Roth,1997,https://images.thegreatestbooks.org/zmngc6psc9letgua80p9bu4y21ve,"This novel tells the story of Seymour ""Swede"" Levov, a successful Jewish-American businessman and former high school athlete from Newark, New Jersey. Levov's happy and conventional upper middle class life is ruined by the domestic social and political turmoil of the 1960s during the presidency of Lyndon B. Johnson, which in the novel is seen through the eyes of the narrator, Nathan Zuckerman, a budding writer who idolizes the Levovs. The novel portrays the impact of this turmoil on Levov and his family, particularly his rebellious daughter who becomes involved in revolutionary political activities.","Family & Relationships, Fiction, Literary Fiction, Political, Social & Cultural Fiction, Tragedy","American dream, Assimilation, Disillusionment, Family, Generational Conflict, Marines, rebellion, Social change, Terrorism, Trauma",Fiction
Animal Farm,George Orwell,1945,https://images.thegreatestbooks.org/h3439ncrp09yhw6iqefc8mlawv0p,"""Animal Farm"" is a satirical fable set on a farm where the animals revolt, overthrow their human farmer, and take over the running of the farm for themselves. The story is an allegory of the Russian Revolution and the rise of Stalin, and the tale is told by the animals that inhabit the farm, primarily pigs who become the ruling class. Despite their initial attempts at creating an equal society, corruption and power ultimately lead to a regime as oppressive as the one they overthrew.","Allegorical, Fiction, Literary Fiction, Political, Satire","Betrayal, Class Struggle, corruption, Equality, oppression, Political Ideologies, political satire, Power, Propaganda, Revolution",Fiction
Appointment in Samarra,John O'Hara,1934,https://images.thegreatestbooks.org/2rk7ohfe3m02vz20epef214a4bix,"This novel explores the self-destruction of the main character, a successful and respected car dealer, over a three-day span during the Christmas season in 1930. After a series of impulsive and reckless actions, including alienating his friends and family, having an affair, and getting involved with organized crime, the protagonist spirals out of control, leading to his tragic demise. The book offers a critique of the vapid and hypocritical aspects of high society in a small Pennsylvania town during the Great Depression.","Dark Humor, Fiction, Literary Fiction, Realistic Fiction, Social & Cultural Fiction, Tragedy","alcoholism, Classics, Death, Despair, Friendship, Guilt, Infidelity, Marriage, Social Class, Suicide",Fiction
"Are You There God? It's Me, Margaret",Judy Blume,1970,https://images.thegreatestbooks.org/c7ybuqvpq7c4v17fpe32padhdjfm,"The book is a coming-of-age story about a sixth-grade girl who is growing up without a religious affiliation, due to her parents' interfaith marriage. The protagonist is in search of a single religion while also confronting typical pre-teen issues such as buying her first bra, having her first period, coping with crushes and the changes that come with growing up. The book explores themes of friendship, religion, love, and self-identity.","Coming of age, Family & Relationships, Fiction, Realistic Fiction, Young adult","Adolescence, Conduct of life, Correspondence, Family, Family dynamics, Friendship, Jews, Missionaries, puberty, Self-discovery, Teenagers, Youth",Fiction
The Assistant,Bernard Malamud,1957,https://images.thegreatestbooks.org/wmsnc916me02l78hkeexqfyfl9hy,"""The Assistant"" is a story about a struggling Jewish grocer in Brooklyn and his family, who are trying to make ends meet. Their lives dramatically change when a young Italian-American drifter comes to work as their assistant after he was involved in a robbery at their store. The narrative explores themes of guilt, redemption, and the power of good deeds, as the assistant tries to make amends for his past actions, slowly transforming his life and the lives of those around him.","Drama, Fiction, Literary Fiction, Realistic Fiction, Social & Cultural Fiction, Tragedy","Betrayal, Dreams, Family, Forgiveness, Guilt, History, Immigration, Jewish, Poverty, Redemption, Struggle",Fiction
Atonement,Ian McEwan,2001,https://images.thegreatestbooks.org/spfbnnanmt9nyrja25vehnuxoj2f,"Atonement is a powerful novel that explores the consequences of a young girl's false accusation. The narrative follows the lives of three characters, the accuser, her older sister, and the sister's lover, who is wrongly accused. This false accusation irrevocably alters their lives, leading to the accused's imprisonment and eventual enlistment in World War II, while the sisters grapple with guilt, estrangement, and their own personal growth. The novel is a profound exploration of guilt, forgiveness, and the destructive power of misinterpretation.","Allegorical, Coming of age, Fiction, Historical fiction, Literary Fiction, Psychological","class, Country life, Family, Family dynamics, Guilt, Injustice, Love, Redemption, Siblings, Teenagers, War, World War II, writing",Fiction
Beloved,Toni Morrison,1987,https://images.thegreatestbooks.org/8cxs5xqxsf3q7shq1x0sawyzkptl,"This novel tells the story of a former African-American slave woman who, after escaping to Ohio, is haunted by the ghost of her deceased daughter. The protagonist is forced to confront her repressed memories and the horrific realities of her past, including the desperate act she committed to protect her children from a life of slavery. The narrative is a poignant exploration of the physical, emotional, and psychological scars inflicted by the institution of slavery, and the struggle for identity and self-acceptance in its aftermath.","Fiction, Historical fiction, Literary Fiction, Magical Realism, Psychological, Social & Cultural Fiction","African American, Community, Family, Family dynamics, Freedom, Ghosts, Guilt, Memory, Motherhood, Race relations, Slavery, Trauma, Women's Studies",Fiction
The Berlin Stories,Christopher Isherwood,1945,https://images.thegreatestbooks.org/5hdtzumlugb3o08a5mgwme0vpctb,"""The Berlin Stories"" is a collection of two novels that present a semi-autobiographical account of the author's time in 1930s Berlin during the rise of the Nazi Party. It vividly portrays the city's underground scene, capturing the lives of a variety of characters from different social classes and backgrounds. The narrative provides a stark and poignant exploration of the human condition against the backdrop of political upheaval and societal change, offering a unique perspective on a critical period in history.","Fiction, Historical fiction, Literary Fiction, Modernist, Social & Cultural Fiction","Decadence, Friendship, Lgbtq+, Politics, Poverty, Sexuality, Society, Survival, Transformation",Fiction
The Big Sleep,Raymond Chandler,1939,https://images.thegreatestbooks.org/kkn3ul1o471bxbzvrsd2781sh6xw,"In this classic detective novel, a private investigator is hired by a wealthy family to resolve a blackmail issue involving the younger daughter. As he delves deeper into the case, he uncovers a web of deceit, murder, and organized crime. The detective's investigation is further complicated by his growing attraction to the older daughter, adding a layer of personal involvement to an already complex case. The novel is renowned for its gritty depiction of 1930s Los Angeles and its sharp, witty dialogue.","Crime, Fiction, Hard Boiled, Mystery, noir","Addiction, Blackmail, corruption, Deception, Detective, Family, Murder, Wealth",Fiction
The Blind Assassin,Margaret Atwood,2000,https://images.thegreatestbooks.org/rxqq7wjkias74hv3gvtxu3m0rld4,"The novel is a complex narrative that weaves together the story of two sisters in early 20th century Canada, one of whom publishes a scandalous novel that leads to her suicide. The surviving sister, now an elderly woman, reflects on their lives, revealing family secrets, heartbreak, and the truth behind the scandalous novel. The narrative is interspersed with excerpts from the controversial book, a science fiction story within a story, adding layers of intrigue and mystery.","Drama, Fiction, Literary Fiction, Magical Realism, Mystery, Postmodern, Psychological","Betrayal, class, Crafts, Hobbies & Home, Death, Death & Grief, Family, Love, Memory, Power, relationships, secrets, Storytelling",Fiction
Blood Meridian,Cormac McCarthy,1985,https://images.thegreatestbooks.org/qq1qm2dpsgbw46qfktcufx08rod1,"Set in the mid-19th century, this novel follows a violent teenager known as ""the Kid"" as he joins a group of Indian-hunters led by the enigmatic and brutal Judge Holden. The narrative is a gruesome depiction of the lawless American West, filled with philosophical musings, vivid descriptions of the harsh landscape, and brutal, relentless violence. The story explores themes of human nature, morality, and the inherent chaos and brutality of life.","Dark, Fiction, Historical fiction, Literary Fiction, philosophical, Picaresque, Westerns","Chaos, Existentialism, human nature, isolation, Manifest Destiny, morality, Survival, Violence",Fiction
Brideshead Revisited,Evelyn Waugh,1945,https://images.thegreatestbooks.org/h45dvxsmu924istz2u4yn7t3pt2t,"The novel is a nostalgic story about the narrator's involvement with the Flyte family, British aristocrats living in a grand mansion called Brideshead. The story explores themes of faith, love, and the decline of the British aristocracy, primarily through the narrator's relationships with the family's Catholic faith and his complicated friendship with the family's son and his love for the daughter. The novel is set in the backdrop of the time period between the two World Wars.","Coming of age, Drama, Fiction, Historical fiction, Literary Fiction, Social & Cultural Fiction","alcoholism, class, Faith, Family, Family dynamics, Friendship, Love, Nostalgia, relationships, Upper class",Fiction
The Bridge of San Luis Rey,Thornton Wilder,1927,https://images.thegreatestbooks.org/hy48d6na7idqz0au869ny5feu1g8,"""The Bridge of San Luis Rey"" is a novel that explores the nature of love and the meaning of life, set in 18th century Peru. The narrative revolves around a tragic incident where five people die when a rope bridge collapses. A Franciscan monk, who witnesses the accident, embarks on a quest to find out why these particular people had to die, hoping to prove that it was divine intervention. The book delves into the lives of the victims, revealing their personal stories, their hopes, dreams, and disappointments, as the monk attempts to decipher the cosmic significance of this tragedy.","Allegorical, Fiction, Historical fiction, Literary Fiction, philosophical, Tragedy","Accidents, Death, Death & Grief, Education, Existence, Faith, Fate, Humanity, Love, relationships, Schools & Teaching",Fiction
Call It Sleep,Henry Roth,1934,https://images.thegreatestbooks.org/93xnyghdqvyhztpgoj985wx8q7ka,"This novel tells the story of a young Jewish boy, David Schearl, who immigrates to New York City with his mother in the early 20th century. The narrative explores David's struggles to understand his harsh father, his experiences with anti-Semitism and poverty in the Lower East Side, and his journey of self-discovery through his vivid imagination. The boy's fears and dreams are depicted through a stream-of-consciousness narrative technique, providing a powerful exploration of the immigrant experience and the harsh realities of the American dream.","Coming of age, Fiction, Literary Fiction, Modernist, Social & Cultural Fiction","Assimilation, childhood, Family, fear, History, Immigrants, Immigration, isolation, Jewish, Jews, Poverty, Violence",Fiction
Catch-22,Joseph Heller,1961,https://images.thegreatestbooks.org/ko1vvki8iz0rgo2adztdcnues4dr,"The book is a satirical critique of military bureaucracy and the illogical nature of war, set during World War II. The story follows a U.S. Army Air Forces B-25 bombardier stationed in Italy, who is trying to maintain his sanity while fulfilling his service requirements so that he can go home. The novel explores the absurdity of war and military life through the experiences of the protagonist, who discovers that a bureaucratic rule, the ""Catch-22"", makes it impossible for him to escape his dangerous situation. The more he tries to avoid his military assignments, the deeper he gets sucked into the irrational world of military rule.","Absurdist, Dark Humor, Fiction, Literary Fiction, Postmodern, Satire","Bureaucracy, Death, fear, Friendship, Heroism, Insanity, Military, Psychology & Mental Health, Survival, War, World War II",Fiction
The Catcher in the Rye,J. D. Salinger,1951,https://images.thegreatestbooks.org/azrr7j37ttxak2wmpmdoczhvd36t,"The novel follows the story of a teenager named Holden Caulfield, who has just been expelled from his prep school. The narrative unfolds over the course of three days, during which Holden experiences various forms of alienation and his mental state continues to unravel. He criticizes the adult world as ""phony"" and struggles with his own transition into adulthood. The book is a profound exploration of teenage rebellion, alienation, and the loss of innocence.","Coming of age, Fiction, Literary Fiction, Realistic Fiction, Social & Cultural Fiction, Young adult","Adolescence, Alienation, depression, Family, Identity, Innocence, isolation, Phoniness, rebellion",Fiction
A Clockwork Orange,Anthony Burgess,1962,https://images.thegreatestbooks.org/av2n6i4llznglkd50os5mygxpojn,"This novel follows the life of a violent young man named Alex, who is part of a youth subculture in a dystopian future England. Alex and his gang engage in a nightmarish spree of rape, assault, and robbery, until he is arrested and subjected to a psychological experiment by the government to ""cure"" him of his violent tendencies. The novel explores themes of free will, morality, and the nature of evil, while using a unique slang language invented by the author.","Dark, Dystopian, Fiction, philosophical, Picaresque, Postmodern, Speculative Fiction","Control, Free will, Government, morality, Psychology, Rehabilitation, Teenagers, Violence, Youth",Fiction
The Confessions of Nat Turner,William Styron,1967,https://images.thegreatestbooks.org/hs1f4ot2sc3nucyzajabeyu4uz6g,"""The Confessions of Nat Turner"" is a fictionalized account of a historical event, the 1831 Virginia slave uprising led by Nat Turner. The book is presented as a first-person narrative from Turner's perspective, exploring his life as a slave, his religious visions, and the violent rebellion he led against white slaveholders. The novel delves into the complexities of slavery, morality, and rebellion, while also examining the psychological trauma inflicted by the institution of slavery.","Fiction, Historical fiction, Literary Fiction, Social & Cultural Fiction, Tragedy","African American, African American History, American History, Freedom, Guilt, History, Injustice, oppression, Racism, rebellion, Slavery, Violence",Fiction
The Corrections,Jonathan Franzen,2001,https://images.thegreatestbooks.org/5kpzrqxgeylm8za0dclf2oma7u4v,"The novel revolves around the lives of the Lambert family, an old-fashioned midwestern couple and their three adult children. The parents, Alfred and Enid, are dealing with Alfred's Parkinson's disease and their own marital problems, while their children are each facing their own personal and professional crises. The narrative explores the themes of family dynamics, societal expectations, and the struggles of modern life. The story climaxes with the family's last Christmas together at their childhood home.","Drama, Fiction, Literary Fiction, Psychological, Social & Cultural Fiction","Aging, consumerism, Disillusionment, Family, Family dynamics, Identity, Marriage, Mental illness, Midlife crisis, Technology",Fiction
The Crying of Lot 49,Thomas Pynchon,1966,https://images.thegreatestbooks.org/wdd93cg2xyyuw7w3p6xvapkkwsln,"The novel follows the journey of a woman who stumbles upon a centuries-old conflict between two mail distribution companies when she is appointed the executor of her ex-lover's will. As she delves deeper into the mystery, she begins to question her own sanity and the reality of the conspiracy itself. The story explores themes of communication, interpretation, and the struggle to find meaning in a chaotic world.","Absurdist, Fiction, Literary Fiction, metafiction, Mystery, Postmodern","Communication, Conspiracy, Entropy, isolation, Paranoia, Postal System, Secret societies, Symbols, Technology",Fiction
A Dance to the Music of Time,Anthony Powell,1951,https://images.thegreatestbooks.org/4m3e4d8lvsu7ztehq1610tgwa5zz,"""A Dance to the Music of Time"" is a twelve-volume cycle that follows the life of the protagonist, a man from the upper-middle class in England, from his school days to his old age. The series provides a detailed and satirical depiction of British society and its changes over several decades, from the 1920s to the 1970s. The narrative is filled with a rich cast of characters from different social classes and backgrounds, whose lives intersect in various ways over time.","Coming of age, Fiction, Historical fiction, Literary Fiction, Modernist, Postmodern, Social & Cultural Fiction","class, Friendship, History, Love, Marriage, Politics, Society, War, World War II",Fiction
The Day of the Locust,Nathanael West,1939,https://images.thegreatestbooks.org/1sex8sjpue6hjq7d57e68ehhjanc,"""The Day of the Locust"" is a novel set in 1930s Hollywood, portraying the dark side of the American dream through the lives of its desperate characters. The protagonist, a young artist from the East Coast, finds himself disillusioned by the superficiality and decay of Hollywood society, which is filled with failed actors, charlatans, and lost souls. The narrative culminates in a violent riot, symbolizing the destructive power of frustrated dreams and the harsh reality of the American dream.","Dark, Fiction, Literary Fiction, Satire, Social & Cultural Fiction, Tragedy","Alienation, Desperation, Disillusionment, Dreams, Failure, Fame, Illusion, Violence",Fiction
Death Comes for the Archbishop,Willa Cather,1927,https://images.thegreatestbooks.org/gfwmmkonnsejhofhrmktnva7e440,"This novel follows the life of a Catholic bishop and a vicar as they attempt to establish a diocese in New Mexico Territory. The story highlights their struggles and triumphs over the course of 40 years, dealing with the harsh landscape, cultural differences, and the challenges of faith. It also explores the history and culture of the Southwest, including the influence of Mexican and Native American traditions.","Fiction, Historical fiction, Literary Fiction, Religion & Spirituality, Social & Cultural Fiction","American History, Catholicism, Christianity, colonialism, Community, Cultural Conflict, Faith, Friendship, History, Leadership, Missionary Work, Native American, tradition",Fiction
A Death in the Family,James Agee,1957,https://images.thegreatestbooks.org/yv2y9o1u0fod6dq59itsqdqx8mf5,"The novel centers around the tragic death of a young father in a car accident, exploring its profound impact on his family. The narrative delves into the grieving process of his wife, children, and extended family in Knoxville, Tennessee in 1915. The story explores themes of love, loss, and the struggle to find meaning in the face of tragic circumstances. It is a poignant examination of the human condition and the inevitable experience of loss.","Coming of age, Family & Relationships, Fiction, Literary Fiction, Realistic Fiction, Tragedy","childhood, Death, Death & Grief, Family, Family dynamics, Grief, Loss, Memory, Southern Gothic",Fiction
The Death of the Heart,Elizabeth Bowen,1938,https://images.thegreatestbooks.org/tbue3jqva8p0nkwcan0i29e75ofs,"""The Death of the Heart"" is a novel set in the interwar period, focusing on a sixteen-year-old orphan girl who moves in with her wealthy half-brother and his wife in London. As she navigates the complexities of her new social environment, she develops a crush on a friend of the family, leading to a series of misunderstandings and betrayals. The novel explores themes of innocence, love, betrayal, and the harsh realities of adulthood.","Coming of age, Fiction, Literary Fiction, Psychological, Social & Cultural Fiction, Tragedy","Adolescence, Betrayal, Family, Innocence, loneliness, Love, orphans",Fiction
Deliverance,James Dickey,1970,https://images.thegreatestbooks.org/t4ean1cjj3ye5frborthza4pphew,"Four friends from Atlanta embark on a canoe trip in the remote wilderness of Georgia, expecting a fun, adventurous weekend. However, their journey quickly turns into a nightmare when they are brutally attacked by a pair of backwoods locals. The friends are forced to kill their attackers in self-defense, leading to a harrowing escape down the river and through the woods, pursued by vengeful locals. The experience forever changes their lives, leaving them with deep physical and psychological scars.","Adventure, Fiction, Horror, Literary Fiction, Psychological, Speculative Fiction, Thriller & Suspense","conflict, fear, Friendship, masculinity, Nature, Survival, Violence",Fiction
Dog Soldiers,Robert Stone,1974,https://images.thegreatestbooks.org/8e557mqxtaxovx1exj7ci1n3sp1n,"In this novel, a disillusioned war correspondent, a morally compromised professor, and a woman caught between them become embroiled in a dangerous plot involving heroin smuggling from Vietnam to California. As they navigate the treacherous landscape of addiction, violence, and betrayal, the characters are forced to confront the devastating consequences of their choices. The book explores the dark underbelly of the American dream and the brutal realities of war.","Crime, Fiction, Literary Fiction, Political, Thriller & Suspense","Addiction, Betrayal, Drugs, Journalism, morality, Smuggling, Survival, Violence, War, World War II",Fiction
Falconer,John Cheever,1977,https://images.thegreatestbooks.org/m6c44goau6rt7hxeg9v6quup2axs,"The novel follows the story of a man named Ezekiel Farragut, a university professor and drug addict who is serving time in Falconer State Prison for the murder of his brother. Through his experiences and interactions with other inmates, Farragut grapples with guilt, addiction, and the human condition, ultimately leading to his escape and a chance at redemption. The narrative explores themes of freedom, identity, and the complexities of familial relationships.","Dark, Fiction, Literary Fiction, Psychological, Social & Cultural Fiction, Tragedy","Addiction, Family, Forgiveness, Friendship, Guilt, isolation, Lgbtq+, prison, Prisoners, Redemption, Violence",Fiction
The French Lieutenant's Woman,John Fowles,1969,https://images.thegreatestbooks.org/v6jf2s51b0m9u5hc0z4mahs18w20,"Set in the Victorian era, the story revolves around a complex love triangle involving a gentleman engaged to a well-bred woman and his infatuation with a mysterious woman known as the French Lieutenant's Woman. This woman, shrouded in scandal and mystery, challenges the protagonist's conventional views of society and morality. The novel, known for its metafictional style, explores themes of freedom, responsibility, and the oppressive social norms of the time.","Allegorical, Fiction, Historical fiction, Literary Fiction, Postmodern, Victorian","Class Conflict, Existentialism, Freedom, Identity, Love, Nature, Victorian Society, Women's Studies",Fiction
The Golden Notebook,Doris May Lessing,1962,https://images.thegreatestbooks.org/2jyfxtcn1u7nab2m4vii8zj5rp63,"The novel centers around a woman named Anna Wulf, a writer who keeps four notebooks, each representing a different aspect of her life: her experiences in Africa, her current life in London, a novel she is writing, and her personal experiences. As Anna's mental state deteriorates, she attempts to unify her fragmented self in a fifth notebook, the golden notebook. The novel explores themes of mental breakdown, communism, the changing role of women, and the fear of nuclear war.","Fiction, Literary Fiction, Modernist, Postmodern, Psychological, Social & Cultural Fiction","colonialism, Communism, Diaries, Feminism, Mental Health, Politics, relationships, Sexuality, Women's Studies, writing",Fiction
