Title,Authors,Published Date,Image,Description,Genre Categories,Subject Categories,Type
One Flew Over the Cuckoo's Nest,Ken Kesey,1962,https://images.thegreatestbooks.org/hpkvb06rrt20xsczittuye3qwmil,"Set in a psychiatric hospital in Oregon, the novel is narrated by a half-Native American patient known as Chief Bromden, who pretends to be deaf and mute. The story follows the arrival of a new patient, a boisterous, rebellious man who challenges the oppressive and dehumanizing system of the hospital, particularly the tyrannical Nurse Ratched. The book explores themes of individuality, rebellion, and the misuse of power, ultimately leading to a tragic conclusion.","Banned books, Dark, Fiction, Literary Fiction, Psychological, Social & Cultural Fiction","Authority, Conformity, Freedom, Individualism, institutionalization, Power Dynamics, Psychology & Mental Health, rebellion",Fiction
The Painted Bird,Jerzy Kosinski,1965,https://images.thegreatestbooks.org/fv518vaz47o1mqt18ltv94f26464,"""The Painted Bird"" is a dark and harrowing novel set in Eastern Europe during World War II. The story follows a young, unnamed boy of unknown ethnicity who is sent by his parents to live in a remote village for safety. However, he is instead subjected to brutal violence, abuse, and superstition by the superstitious peasants. The book explores themes of survival, human cruelty, and the loss of innocence in the face of war and hatred.","Banned books, Drama, Fiction, Literary Fiction, Psychological, Social & Cultural Fiction","Humanity, Identity, Innocence, isolation, Prejudice, Survival, Trauma, Violence",Fiction
Pale Fire,Vladimir Nabokov,1962,https://images.thegreatestbooks.org/alk1kldf1uc0ypwkx4t28e4ebs1k,"The novel is a unique blend of fiction, commentary, and poetry, presented as a 999-line poem written by a fictional poet, followed by an extensive commentary and foreword by his neighbor and academic colleague. The novel blurs the line between reality and fiction, as the commentator's notes reveal an alternative narrative, one of exile, intrigue, and murder. The book is a playful exploration of authorship, deception, and the nature of art.","Experimental, Fiction, Literary Fiction, metafiction, Mythological, Postmodern","Criticism, Death, Friendship, Immigrants, Madness, Murder, Nobility, Obsession, Paranoia, Parody",Fiction
A Passage to India,E. M. Forster,1924,https://images.thegreatestbooks.org/u1f1gvwrdtv17py5la89n532hyry,"The novel takes place in British-ruled India, where the cultural divide between the British and the Indians is explored. The story focuses on the experiences of an Indian Muslim, Dr. Aziz, and his interactions with an English woman, Miss Quested, and her elderly friend, Mrs. Moore. After an expedition to the Marabar Caves, Miss Quested accuses Dr. Aziz of assault, leading to a trial that deepens the racial tensions and prejudices between the colonizers and the colonized. The novel is a critique of British imperialism and a study of the cultural and racial misunderstandings and ill-will between the British and the Indian people.","Fiction, Historical fiction, Literary Fiction, philosophical, Political, Social & Cultural Fiction","colonialism, Cultural Conflict, Friendship, Justice, Novela, Race relations, Racism, Social Class",Fiction
Play It As It Lays,Joan Didion,1970,https://images.thegreatestbooks.org/ub4fc24bqe82m91dc4tnbu7w7wzg,"The novel centers around a woman named Maria Wyeth, a former model and actress, who is drifting through life in the 1960s Hollywood scene. As she struggles with a failing marriage, a difficult relationship with her daughter, and a career that's spiraling downwards, she grapples with existential despair. Told in a series of fragmented narratives, the story reveals Maria's mental breakdown, her self-destructive behavior, and her desperate attempts to find meaning in a seemingly meaningless world.","Allegorical, Fiction, Literary Fiction, Postmodern, Psychological, Social & Cultural Fiction","abortion, Addiction, Alienation, depression, Despair, Existentialism, Mental illness, relationships, Women's Studies",Fiction
Portnoy's Complaint,Philip Roth,1969,https://images.thegreatestbooks.org/h6hg31chrwr5e64vbrnf4ano2bsa,"The novel is a first-person narrative, a monologue by a young Jewish man, Alexander Portnoy, who is speaking to his psychoanalyst. He shares his struggles with his identity as a Jewish man in America, his sexual fantasies and frustrations, his complex relationship with his overbearing mother, and his experiences of guilt and shame. The book uses humor and frank language to explore themes of identity, sexuality, and the Jewish experience in America.","Adult, Fiction, Literary Fiction, Satire, Social & Cultural Fiction","Adolescence, Desire, Family, Guilt, Jewish Identity, Jews, Psychotherapy, Repression, Sexual behavior, Sexuality",Fiction
Possession,A. S. Byatt,1990,https://images.thegreatestbooks.org/2xh7x7911al9lbmj6pd48a73vupp,"""Possession"" is a novel that interweaves two storylines, one set in contemporary times and the other in the Victorian era. The contemporary plot follows two academics who uncover a secret love affair between two 19th-century poets, while the Victorian storyline presents the clandestine romance itself. As the modern scholars delve deeper into the past, they find themselves falling in love as well, mirroring the historical romance they are researching. The book explores themes of love, passion, and the power of the written word.","Books About Books, Fiction, Historical fiction, Literary Fiction, Literary Letters, Mystery, Postmodern","Academia, letters, Manuscripts, Obsession, relationships, Research, secrets, Victorian",Fiction
The Power and the Glory,Graham Greene,1940,https://images.thegreatestbooks.org/3c1dh9cfodfv2l38uz2559dw5dfq,"The novel is set during the Mexican Revolution, focusing on a whisky priest who is on the run from the authorities who have outlawed Catholicism. The priest, who is flawed and sinful, travels across the country to evade capture, minister to the faithful, and find a way to repent for his sins. Despite his moral failings, the priest's compassion and commitment to his faith make him a symbol of hope and resilience in the face of oppression. The book explores themes of faith, redemption, and the human struggle with sin.","Allegorical, Fiction, Historical fiction, Literary Fiction, Religion & Spirituality, Social & Cultural Fiction","Catholicism, corruption, Despair, Faith, isolation, Martyrdom, Persecution, Redemption, Sin",Fiction
The Prime of Miss Jean Brodie,Muriel Spark,1961,https://images.thegreatestbooks.org/a03e65l1uerkweze2o592awec95f,"The novel is set in 1930s Edinburgh and follows the story of six girls under the tutelage of an unconventional teacher, Miss Jean Brodie. Miss Brodie, in her prime, takes it upon herself to educate the girls about life, love, politics, and art, often disregarding the traditional curriculum. The narrative explores the influence of Miss Brodie on the girls, the consequences of her nonconformist teachings, and the ultimate betrayal that leads to her downfall.","Coming of age, Fiction, Literary Fiction, Psychological, Social & Cultural Fiction","Betrayal, Conformity, Education, Friendship, Individualism, Manipulation, morality, Politics, Teachers, World War II",Fiction
"Rabbit, Run",John Updike,1960,https://images.thegreatestbooks.org/jwtfmbyjyubxsvg633vnaemmvsq2,"The novel follows the life of a 26-year-old former high school basketball star, who is dissatisfied with his current life. He impulsively leaves his wife and son and embarks on a journey in the hopes of finding a more meaningful existence. His decisions, however, lead to a series of tragic events that impact the lives of those around him. This mid-20th-century novel explores themes of freedom, responsibility, and the tragic consequences of impulsive decisions.","Fiction, Literary Fiction, Realistic Fiction, Social & Cultural Fiction, Tragedy","Death & Grief, Disillusionment, Escape, Freedom, Infidelity, realism, relationships, Responsibility",Fiction
Ragtime,E. L. Doctorow,1975,https://images.thegreatestbooks.org/ej3uxbrsrwymosmhde4najpkpudw,"Set in the early 20th century, this novel intertwines the lives of fictional characters with real historical figures, creating a vivid portrayal of America's past. The narrative follows the lives of an upper-class family in New Rochelle, New York, an African-American musician from Harlem, and a Jewish immigrant and his daughter, while also featuring historical figures like Harry Houdini, J.P. Morgan, and Henry Ford. The novel explores themes of wealth, race, and class, against a backdrop of significant historical events, such as the onset of World War I and the rise of the labor movement.","Allegorical, Fiction, Historical fiction, Literary Fiction, Postmodern, Social & Cultural Fiction","Alternate History, American dream, Class Struggle, Family, Family dynamics, Historical Figures, Immigration, Industrialization, Racism, Sociology",Fiction
The Recognitions,William Gaddis,1955,https://images.thegreatestbooks.org/4r75ykc1d0cj9wvmunf1xsl7l94r,"The novel is a complex and lengthy examination of authenticity and forgery. It tells the story of a young man who becomes a master forger of Old Masters paintings, while exploring themes of identity, religion, and art. As the plot unfolds, the protagonist grapples with his own authenticity in a world obsessed with appearances and material success. The narrative is interspersed with philosophical and religious discussions, making it a challenging yet thought-provoking read.","Allegorical, Encyclopedic, Experimental, Fiction, Literary Fiction, philosophical, Postmodern","Ambition, Deception, Family, Forgery, Guilt, isolation, Obsession",Fiction
Red Harvest,Dashiell Hammett,1929,https://images.thegreatestbooks.org/9ljk9osi66u96re21e28lic1171n,"In this hard-boiled detective novel, a private investigator is hired by a newspaper publisher in a corrupt western town to uncover the truth behind the murder of a local worker. As he delves deeper into the investigation, he finds himself embroiled in a chaotic war between rival gangs, corrupt police, and greedy industrialists. The detective uses his cunning and manipulation to turn these factions against each other, leading to a bloody and violent resolution.","Crime, Fiction, Hard Boiled, Mystery, noir","corruption, Deception, Detective, Gangs, History, Murder, Revenge, Violence",Fiction
Revolutionary Road,Richard Yates,1961,https://images.thegreatestbooks.org/3ref4guzpxjygv6lzxkd01fk7ieg,"This novel revolves around Frank and April Wheeler, a young couple living in a Connecticut suburb during the mid-1950s. Struggling with the banality of their lives, they plan to move to France where they believe they will be able to live more fulfilling and enlightened lives. However, their plans are derailed by a surprise pregnancy and the pressures of societal expectations, leading to a tragic end. The book explores themes of conformity, the search for self-fulfillment, and the disillusionment of the American Dream.","Drama, Fiction, Literary Fiction, Realistic Fiction, Social & Cultural Fiction, Tragedy","Conformity, Despair, Disillusionment, Dreams, Escape, Family, Family dynamics, Infidelity, Marriage, Mental Health",Fiction
The Sheltering Sky,Paul Bowles,1949,https://images.thegreatestbooks.org/vh881yuo1g5r2nwtmw047b9u48oq,"""The Sheltering Sky"" is a novel about an American couple, Port and Kit Moresby, who travel to the North African desert accompanied by their friend Tunner. The journey, initially an attempt to cure their marital woes, quickly descends into a harrowing journey of self-discovery and exploration of the human condition. As they move further into the desert, the harsh environment and their isolation from the outside world push them to their psychological limits, leading to devastating consequences.","Fiction, Literary Fiction, philosophical, Social & Cultural Fiction, Tragedy, Travel","Alienation, Cultural Clash, Death, Despair, Existentialism, isolation, Marriage, Mental illness",Fiction
Slaughterhouse-Five,Kurt Vonnegut,1969,https://images.thegreatestbooks.org/29crzkb6nzqei6b3ymewpdeq9nib,"The novel follows the life of Billy Pilgrim, a World War II veteran who has become ""unstuck in time,"" experiencing his life events out of order. This includes his experiences as a prisoner of war in Dresden during the Allies' firebombing, his post-war life as a successful optometrist, his abduction by aliens from the planet Tralfamadore, and his eventual death. The book is a critique of war and a demonstration of the destructive nature of time, with a nonlinear narrative that reflects the chaos and unpredictability of life.","Dark, Fiction, Literary Fiction, Postmodern, Satire, Science fiction, Social & Cultural Fiction, Speculative Fiction","Death & Grief, Fate, Free will, Survival, Time, Trauma, War",Fiction
Snow Crash,Neal Stephenson,1992,https://images.thegreatestbooks.org/m4epvys4nm4xzqje7f8mmlduaxvm,"In a future America where the federal government has largely collapsed and been replaced by corporate entities, a computer hacker and pizza delivery driver becomes embroiled in a plot involving a dangerous new drug and a computer virus called ""Snow Crash"". He is joined by a teenage skateboard courier and a host of other characters in a high-stakes race to uncover the truth behind the virus and its origins in ancient Sumerian culture. The narrative explores themes of linguistics, philosophy, computer science, religion, and cryptography.","Cyberpunk, Dystopian, Fiction, Postmodern, Science fiction, Speculative Fiction","Corporate power, Dystopia, Hacker Culture, Identity, Information technology, Linguistics, surveillance, Virtual reality",Fiction
The Sot-Weed Factor,John Barth,1960,https://images.thegreatestbooks.org/72gcd3ehd1zt91415doszqoqiivc,"""The Sot-Weed Factor"" is a satirical, picaresque novel set in the late 17th century, revolving around an innocent poet from London who is tricked into becoming a tobacco sot-weed factor in Maryland. The protagonist's misadventures, filled with mistaken identities, pirates, Native Americans, and a wide array of eccentric characters, mirror the challenges and absurdities of America's early colonial period. The narrative, rich in historical detail and parody, explores themes of identity, truth, and the nature of reality.","Dark, Fiction, Literary Fiction, Picaresque, Postmodern, Satire","American History, colonialism, Deception, History, Parody, Politics, Sexuality",Fiction
The Sound and the Fury,William Faulkner,1929,https://images.thegreatestbooks.org/rdpy3x07a9ulnzu31sqdyp866o8b,"The novel is a complex exploration of the tragic Compson family from the American South. Told from four distinct perspectives, the story unfolds through stream of consciousness narratives, each revealing their own understanding of the family's decline. The characters grapple with post-Civil War societal changes, personal loss, and their own mental instability. The narrative is marked by themes of time, innocence, and the burdens of the past.","Allegorical, Fiction, Literary Fiction, Modernist, Psychological, Social & Cultural Fiction, Tragedy","class, Death, Death & Grief, Family, Guilt, History, Loss, Memory, Mental illness, race, Southern Gothic, stream of consciousness, Time, tradition",Fiction
The Sportswriter,Richard Ford,1986,https://images.thegreatestbooks.org/dizn071y6q5eu2bf4lmwmacdtkik,"This novel explores the life of a suburban New Jersey man who makes his living as a sportswriter. After experiencing the death of his son and subsequent divorce, he attempts to maintain a positive outlook on life and keep his personal despair at bay. The book delves into his relationships, encounters, and introspections during a transformative Easter weekend, providing a deep analysis of his character and his struggle to find meaning and purpose in the face of tragedy.","Contemporary, Fiction, Literary Fiction, Psychological, Realistic Fiction, Social & Cultural Fiction","Divorce, Existentialism, Fatherhood, Friendship, Grief, Marriage, Midlife crisis, relationships, Sportswriting",Fiction
The Spy Who Came in From the Cold,John le Carré,1963,https://images.thegreatestbooks.org/5lpkyc5l9k0ep4pdhd8hs5wq4rpg,"This novel is a fascinating tale of espionage during the Cold War, centered around a British intelligence officer who is seemingly ready to end his spy career. However, he is given one last mission before his retirement: to bring down the head of East German Intelligence. As he navigates the dangerous world of spies and double agents, he is forced to confront his own past and the sacrifices he has made for his country. The story is a complex exploration of morality, loyalty, and the personal cost of political conflict.","Fiction, Literary Fiction, noir, Spy, Thriller & Suspense","Betrayal, Cold War, Deception, Double Agents, Espionage, Intelligence Agencies, Loyalty, Manipulation, morality, Sacrifice",Fiction
The Sun Also Rises,Ernest Hemingway,1926,https://images.thegreatestbooks.org/90d6cqu5ff8x7xjzpcxn6qgne8zw,"The novel is a poignant tale set in the 1920s post-World War I era, focusing on a group of American and British expatriates living in Paris who travel to Pamplona, Spain for the annual Running of the Bulls. The story explores themes of disillusionment, identity, and the Lost Generation, with the protagonist, a war veteran, grappling with impotence caused by a war injury. The narrative is steeped in the disillusionment and existential crisis experienced by many in the aftermath of the war, and the reckless hedonism of the era is portrayed through the characters' aimless wanderings and excessive drinking.","Allegorical, Fiction, Literary Fiction, Modernist, Social & Cultural Fiction","Alcohol, Bullfighting, Disillusionment, Expatriates, Friendship, History, Love, masculinity, Post-war trauma, relationships, War, World War I",Fiction
Their Eyes Were Watching God,Zora Neale Hurston,1937,https://images.thegreatestbooks.org/v1ss2z703lajpsojia4k1bxf4luw,"This novel follows the life of Janie Crawford, a young African-American woman, in the early 20th century. She embarks on a journey through three marriages and self-discovery while challenging the societal norms of her time. The narrative explores her struggle for personal freedom, fulfillment, and identity against the backdrop of racism and gender expectations, ultimately emphasizing the importance of independence and personal growth.","Coming of age, Fiction, Literary Fiction, Magical Realism, Social & Cultural Fiction","African American, African American History, Community, Freedom, gender, History, Love, Marriage, Psychology & Mental Health, race, relationships, Self-discovery",Fiction
Things Fall Apart,Chinua Achebe,1958,https://images.thegreatestbooks.org/6z3xzl6xj1kcli70y1evveockwsk,"This novel explores the life of Okonkwo, a respected warrior in the Umuofia clan of the Igbo tribe in Nigeria during the late 1800s. Okonkwo's world is disrupted by the arrival of European missionaries and the subsequent clash of cultures. The story examines the effects of colonialism on African societies, the clash between tradition and change, and the struggle between individual and society. Despite his efforts to resist the changes, Okonkwo's life, like his society, falls apart.","Coming of age, Fiction, Historical fiction, Literary Fiction, Social & Cultural Fiction","change, colonialism, Community, conflict, Family, Indigenous, Juvenile, masculinity, Power, Race relations, tradition",Fiction
To Kill a Mockingbird,Harper Lee,1960,https://images.thegreatestbooks.org/i89xmzpnegqaudeu18htg32fsuug,"Set in the racially charged South during the Depression, the novel follows a young girl and her older brother as they navigate their small town's societal norms and prejudices. Their father, a lawyer, is appointed to defend a black man falsely accused of raping a white woman, forcing the children to confront the harsh realities of racism and injustice. The story explores themes of morality, innocence, and the loss of innocence through the eyes of the young protagonists.","Coming of age, Drama, Fiction, Literary Fiction, Social & Cultural Fiction","childhood, Courage, Empathy, Family, Justice, Moral Growth, Prejudice, Racism, Social Inequality",Fiction
To the Lighthouse,Virginia Woolf,1927,https://images.thegreatestbooks.org/wzmdha2vv3rymlh280yys7vdw43u,"This novel is a pioneering work of modernist literature that explores the Ramsay family's experiences at their summer home on the Isle of Skye in Scotland. The narrative is divided into three sections, focusing on a day in the family's life, a description of the house during their absence, and their return after ten years. The book is known for its stream of consciousness narrative technique and its exploration of topics such as the passage of time, the nature of art, and the female experience.","Allegorical, Fiction, Literary Fiction, Modernist, philosophical, Psychological","childhood, Death, Death & Grief, Family, gender, Marriage, Memory, Nature, stream of consciousness, Time",Fiction
Tropic of Cancer,Henry Miller,1934,https://images.thegreatestbooks.org/kxoszul8pqqv9j6d7b1au7x1iugi,"The book is a semi-autobiographical novel set in 1930s Paris and describes the protagonist's life as a struggling writer. The narrative is filled with vivid descriptions of the city, sexual encounters, and philosophical musings, all penned in a stream-of-consciousness style. The protagonist's experiences living in poverty, his relationships with other expatriates, and his pursuit of artistic freedom are central to the story. Despite the explicit content, the novel is noted for its candid exploration of the human condition and the author's quest for personal and creative authenticity.","Allegorical, Erotica, Experimental, Fiction, Literary Fiction, Postmodern, Social & Cultural Fiction","Alienation, Bohemianism, Existentialism, Friendship, Poverty, Sex, Struggle",Fiction
Ubik,Philip K. Dick,1969,https://images.thegreatestbooks.org/vfgy8fsvnw1vk2yad57d25gqub02,"Set in a futuristic world, the novel follows Joe Chip, a technician at a psychic agency, who becomes trapped in a reality-altering phenomenon after a mission on the Moon goes wrong. As his reality begins to unravel, Chip and his colleagues find themselves in a bizarre world where time seems to be moving backward and a mysterious product called ""Ubik"" appears to be the only thing that can save them. The book explores themes of reality, entropy, and human perception in a surreal and often humorous manner.","Experimental, Fiction, Postmodern, Psychological, Science fiction, Speculative Fiction, Surreal","Consciousness, Corporate power, Identity, Mortality, reality, Technology, Time",Fiction
Under the Net,Iris Murdoch,1954,https://images.thegreatestbooks.org/edblrkdt1s2bv6dc0j9bgcjfr97l,"""Under the Net"" is a novel featuring a struggling writer living in London who is forced to reevaluate his life after being evicted from his flat. He embarks on a series of misadventures, meeting a variety of eccentric characters and getting involved in a dog-napping scheme. Throughout his journey, he contemplates philosophical ideas about truth, art, and personal freedom, ultimately leading to his self-discovery and transformation.","Absurdist, Fiction, Literary Fiction, philosophical, Picaresque, Social & Cultural Fiction","Comedy, Communication, Existentialism, Friendship, Philosophy, relationships, Self-discovery",Fiction
Under the Volcano,Malcolm Lowry,1947,https://images.thegreatestbooks.org/ds1k5qt81w754y4b9nymh07na6nz,"Set in Mexico on the Day of the Dead in 1938, the novel follows the last day in the life of Geoffrey Firmin, a British consul with a severe alcohol addiction. Through his interactions with his estranged wife and half-brother, the book explores themes of despair, betrayal, and the destructive power of addiction, against the backdrop of political and social unrest. The impending eruption of the nearby volcano serves as a metaphor for Firmin's deteriorating mental state and the looming world war.","Allegorical, Fiction, Literary Fiction, Modernist, Postmodern, Psychological, Tragedy","alcoholism, Death, Despair, Existentialism, Guilt, Love, Politics, Redemption, relationships",Fiction
Watchmen,Alan Moore,1986,https://images.thegreatestbooks.org/b75zx4nrykif5t2tlerot3pe6jcy,"Set in an alternate history where superheroes emerged in the 1940s and 1980s, the story follows a group of retired superheroes who are brought out of retirement after the murder of one of their own. As they investigate, they uncover a plot that could change the course of history and the balance of world power. The book explores complex themes such as the morality of power, the definition of heroism, and the value of human life.","Comics & Graphic Novels, Dystopian, Fiction, Literary Fiction, Political, Postmodern, Speculative Fiction, Thriller & Suspense","Alternate History, corruption, Existentialism, fear, Friendship, human nature, Identity, Justice, morality, nuclear war, Power, Vigilantism",Fiction
