Title,Authors,Published Date,Image,Description,Genre Categories,Subject Categories,Type
Go Tell it on the Mountain,James Baldwin,1953,https://images.thegreatestbooks.org/ueyyu3c7kxeqkhdmqm81b0sfdmah,"This novel explores the role of the Christian Church in the lives of African-Americans, both as a source of repression and moral hypocrisy and as a source of inspiration and community. It also, more broadly, examines the role of the Pentecostal Church in the African American experience. The narrative focuses on a fourteen-year-old boy's struggle to discover his identity amidst a family filled with secrets and a life marked by a religious community's strict moral code.","Coming of age, Family & Relationships, Fiction, Literary Fiction, Religion & Spirituality, Social & Cultural Fiction","African American, Christianity, Faith, Family, Family dynamics, Forgiveness, Guilt, Racism, Redemption, Sin",Fiction
Gone With the Wind,Margaret Mitchell,1936,https://images.thegreatestbooks.org/390g8tza91c15tc007nx9ogxb1gy,"Set against the backdrop of the American Civil War and Reconstruction era, this novel follows the life of a young Southern belle, who is known for her beauty and charm. Her life takes a turn when she is forced to make drastic changes to survive the war and its aftermath. The story revolves around her struggle to maintain her family's plantation and her complicated love life, especially her unrequited love for a married man, and her tumultuous relationship with a roguish blockade runner.","Fiction, Historical fiction, Literary Fiction, Romance, Sagas","Civil War, Family, History, Identity, Love, Marriage, Reconstruction, Resilience, Slavery, Social Class, Survival, War",Fiction
The Grapes of Wrath,John Steinbeck,1939,https://images.thegreatestbooks.org/wwdwgjm8h0qxhbple76lhf2ygr9e,"The book follows the Joad family, Oklahoma farmers displaced from their land during the Great Depression. The family, alongside thousands of other ""Okies,"" travel to California in search of work and a better life. Throughout their journey, they face numerous hardships and injustices, yet maintain their humanity through unity and shared sacrifice. The narrative explores themes of man's inhumanity to man, the dignity of wrath, and the power of family and friendship, offering a stark and moving portrayal of the harsh realities of American migrant laborers during the 1930s.","Fiction, Historical fiction, Literary Fiction, Social & Cultural Fiction, Tragedy","Community, Despair, Exploitation, Family, Family dynamics, Farm life, History, Injustice, Labor, Migration, Poverty, realism, Survival",Fiction
Gravity's Rainbow,Thomas Pynchon,1973,https://images.thegreatestbooks.org/gqyxw0pynzz1uepfvj1eg92s5c18,"Set during the end of World War II, the novel follows Tyrone Slothrop, a lieutenant in the U.S. Army, as he tries to uncover the truth behind a mysterious device, the ""Schwarzgerät"", that the Germans are using in their V-2 rockets. The narrative is complex and multi-layered, filled with a vast array of characters and subplots, all connected by various themes such as paranoia, technology, and the destructive nature of war. The book is known for its encyclopedic nature and its challenging, postmodernist style.","Allegorical, Encyclopedic, Experimental, Fiction, Literary Fiction, Picaresque, Postmodern, Surreal","Chaos, Conspiracy, Death & Grief, Entropy, Identity, Paranoia, Power, Sexuality, stream of consciousness, Technology, War",Fiction
The Great Gatsby,F. Scott Fitzgerald,1925,https://images.thegreatestbooks.org/ymseqoyhkyhpho50rs2jdjmi2gnn,"Set in the summer of 1922, the novel follows the life of a young and mysterious millionaire, his extravagant lifestyle in Long Island, and his obsessive love for a beautiful former debutante. As the story unfolds, the millionaire's dark secrets and the corrupt reality of the American dream during the Jazz Age are revealed. The narrative is a critique of the hedonistic excess and moral decay of the era, ultimately leading to tragic consequences.","Drama, Fiction, Literary Fiction, Modernist, Social & Cultural Fiction, Tragedy","American dream, class, History, Identity, Illusion, loneliness, Love, morality, Wealth",Fiction
A Handful of Dust,Evelyn Waugh,1934,https://images.thegreatestbooks.org/mnmfoqoi0rmrichzu9by6qfo7d79,"Set in the 1930s, this novel explores the disintegration of the marriage of an upper-class English couple, Tony and Brenda Last. Brenda embarks on an affair with a social climber, John Beaver, leading to the demise of her marriage. After their son's tragic death, Brenda demands a divorce and a large portion of Tony's estate. Tony, heartbroken, embarks on an ill-fated expedition to the Brazilian jungle. The novel critically examines the moral decay of British aristocracy and society.","Absurdist, Dark Humor, Fiction, Literary Fiction, Satire, Tragedy","Adultery, Betrayal, Country life, Despair, Divorce, Friendship, Infidelity, isolation, Marriage, Social Class",Fiction
The Heart Is A Lonely Hunter,Carson McCullers,1940,https://images.thegreatestbooks.org/u0h8g1u9x458x4wi1vdt5vsqfgwq,"The novel explores the spiritual isolation of misfits and outcasts in a small town of the U.S. South. Its protagonist is a deaf-mute who becomes the confidant for various troubled souls including a black physician, a bitter labor activist, a lonely young girl, and a struggling café owner. Each pours their heart out to him, but he remains unable to respond, reflecting the deep human need for connection and understanding.","Fiction, Literary Fiction, Realistic Fiction, Social & Cultural Fiction, Tragedy","Alienation, Communication, Despair, Friendship, History, Identity, isolation, loneliness, Racism",Fiction
The Heart of the Matter,Graham Greene,1948,https://images.thegreatestbooks.org/ea4xy9a96kp6cvp72ln0h35ap5k4,"The novel follows the story of a British colonial police officer stationed in Sierra Leone during World War II. He is an honest and diligent man but finds himself in a moral crisis when he is torn between his duty and his love for another woman. He is caught in a spiral of deceit, corruption, and betrayal that leads to his tragic end. The narrative delves into themes of guilt, faith, betrayal, and moral paradoxes.","Fiction, Literary Fiction, Psychological, Social & Cultural Fiction, Tragedy","Adultery, Classics, colonialism, Colonies, Despair, Duty, Guilt, Redemption, War",Fiction
Herzog,Saul Bellow,1964,https://images.thegreatestbooks.org/7d66l8ou3kftvncn51lp8jhlyerm,"The novel centers around Moses Herzog, a middle-aged, intelligent yet distressed man who is going through a mid-life crisis. After his second marriage fails, he falls into a state of emotional turmoil and begins writing letters to friends, family, and even famous figures, expressing his philosophical thoughts and personal feelings. His journey of self-discovery and understanding forms the crux of the story. It's a profound exploration of a man's struggle with the complexities of life and his quest for meaning.","Fiction, Literary Fiction, philosophical, Postmodern, Psychological, Social & Cultural Fiction","Divorce, Grief, Infidelity, Intellectualism, Love, Mental Health, Redemption, Self-discovery",Fiction
Housekeeping,Marilynne Robinson,1980,https://images.thegreatestbooks.org/xw01h56bxclzmdubmf7i8msn891u,"The novel explores the life of two sisters, Ruth and Lucille, who are raised by a series of relatives in a small, secluded town in Idaho after their mother's suicide. The girls' lives are profoundly affected by the eccentric and transient lifestyle of their aunt Sylvie, who becomes their guardian. The narrative delves deeply into themes of family, identity, womanhood, and the impermanence of life, ultimately leading to a divide between the sisters as they choose different paths in life.","Coming of age, Family & Relationships, Fiction, Literary Fiction, Realistic Fiction, Tragedy","Abandonment, Death & Grief, Family, Family dynamics, Friendship, isolation, Loss, Memory, Mental illness, Mothers & Children, Nature, Siblings, Sisters, Survival",Fiction
A House for Mr. Biswas,V. S. Naipaul,1961,https://images.thegreatestbooks.org/3j0azfaophviqig3y0qtskwf2et3,"The novel narrates the life of Mr. Biswas, a man of Indian descent living in Trinidad, who struggles against poverty and adversity to achieve personal independence and to build a home for himself and his family. Born into a poor family and married into an oppressive one, he constantly strives for autonomy and identity against the backdrop of post-colonial Trinidad. His dream of owning his own house becomes a symbol of his desire for self-determination and respect in a society that often denies him both.","Coming of age, Drama, Fiction, Literary Fiction, Social & Cultural Fiction","Ambition, colonialism, Family, Family dynamics, Journalists, Marriage, Poverty, Self-discovery, Struggle, tradition",Fiction
"I, Claudius",Robert Graves,1934,https://images.thegreatestbooks.org/e3mpib2aq5uhz2sucwm9igw3emmg,"This historical novel is a first-person narrative told from the perspective of the Roman Emperor Claudius, who was considered an unlikely ruler due to his physical ailments and perceived lack of intelligence. The story covers the reigns of Augustus, Tiberius, and Caligula before Claudius unexpectedly becomes emperor. The narrative provides a critical look at the corruption, violence, and political machinations of the Roman Empire, offering a unique perspective on history.","Drama, Fiction, Historical fiction, Literary Fiction, Political, Social & Cultural Fiction","Assassination, Betrayal, corruption, Deception, European History, Family, History, Intrigue, Madness, Politics, Power",Fiction
Infinite Jest,David Foster Wallace,1996,https://images.thegreatestbooks.org/zsyykizvqoxabf9zl63zzx1i70ib,"This novel is a complex, multi-layered narrative that explores themes of addiction, recovery, and the human condition in a near-future society. The story is set in a tennis academy and a halfway house for recovering addicts, and it intertwines the lives of its numerous characters, including a gifted but troubled teenage tennis prodigy, his filmmaker father, and a group of Quebecois separatists. The book is known for its length, intricate plot, and extensive use of footnotes.","Dark, Encyclopedic, Experimental, Fiction, Literary Fiction, Postmodern, Psychological, Social & Cultural Fiction","Addiction, competition, consumerism, depression, Entertainment, Identity, isolation, Psychology & Mental Health, Technology",Fiction
Invisible Man,Ralph Ellison,1952,https://images.thegreatestbooks.org/42vzytzvs31h5z9buogzfv6bdq0r,"The novel is a poignant exploration of a young African-American man's journey through life, where he grapples with issues of race, identity, and individuality in mid-20th-century America. The protagonist, who remains unnamed throughout the story, considers himself socially invisible due to his race. The narrative follows his experiences from the South to the North, from being a student to a worker, and his involvement in the Brotherhood, a political organization. The book is a profound critique of societal norms and racial prejudice, highlighting the protagonist's struggle to assert his identity in a world that refuses to see him.","Allegorical, Coming of age, Fiction, Literary Fiction, philosophical, Social & Cultural Fiction","African American History, Alienation, History, Identity, invisibility, Power, Racism, Self-discovery, Social Injustice",Fiction
Light in August,William Faulkner,1932,https://images.thegreatestbooks.org/mr93yld8h4rublys5yyfp7krt7hi,"Set in the American South during the 1930s, this novel explores complex social and personal issues through the intertwining stories of its characters. The narrative primarily follows a man of ambiguous racial identity on a quest to find his father, a pregnant woman searching for the father of her unborn child, and a disgraced minister attempting to navigate his own moral compass. The book delves into themes of identity, race, and the human struggle for understanding and redemption, all set against the backdrop of the deep-rooted prejudices and social norms of the time.","Coming of age, Fiction, Historical fiction, Literary Fiction, Social & Cultural Fiction, Tragedy","Alienation, Community, Family, Guilt, isolation, Racism, Redemption, Southern Gothic, Violence",Fiction
"The Lion, The Witch and the Wardrobe",C. S. Lewis,1950,https://images.thegreatestbooks.org/9i2cka1273zsx5f3sa5y3jeltz0b,"Four siblings are evacuated from London during World War II and sent to live with an old professor in the countryside. In his house, they discover a magical wardrobe that serves as a portal to the land of Narnia, a world filled with mythical creatures and ruled by an evil White Witch. The children are soon caught up in a struggle to free Narnia from the witch's eternal winter, aided by the majestic lion Aslan. The story combines elements of fantasy, adventure, and Christian allegory.","Adventure, Children's books, Fantasy, Fiction, High Fantasy, Speculative Fiction","Animals, Betrayal, Childhood and youth, Courage, Good vs. Evil, Juvenile, Magic, Mythical Creatures, Redemption, Sacrifice",Fiction
Lolita,Vladimir Nabokov,1955,https://images.thegreatestbooks.org/0tvgtf0ld8dpwlwc7plyu0d6fn5h,"The novel tells the story of Humbert Humbert, a man with a disturbing obsession for young girls, or ""nymphets"" as he calls them. His obsession leads him to engage in a manipulative and destructive relationship with his 12-year-old stepdaughter, Lolita. The narrative is a controversial exploration of manipulation, obsession, and unreliable narration, as Humbert attempts to justify his actions and feelings throughout the story.","Absurdist, Allegorical, Banned books, Fiction, Literary Fiction, Postmodern, Psychological","Desire, Guilt, Identity, Innocence, Manipulation, morality, Obsession, Power Dynamics",Fiction
Lord of the Flies,William Golding,1954,https://images.thegreatestbooks.org/ffglgjldfjl6nxlks6ky559uif9m,"A group of British boys are stranded on an uninhabited island after their plane crashes during wartime. Initially, they attempt to establish order, creating rules and electing a leader. However, as time passes, their civility erodes, and they descend into savagery and chaos. The struggle for power intensifies, leading to violence and death. The novel explores themes of innocence, the inherent evil in mankind, and the thin veneer of civilization.","Allegorical, Dystopian, Fiction, Good and evil, Literary Fiction, Psychological, Speculative Fiction","Civilization, fear, human nature, Innocence, Leadership, Power, Savagery, Survival",Fiction
The Lord of the Rings,J. R. R. Tolkien,1954,https://images.thegreatestbooks.org/uu06j5piucz9yw7atcbi8mbqtd7y,"This epic high-fantasy novel centers around a modest hobbit who is entrusted with the task of destroying a powerful ring that could enable the dark lord to conquer the world. Accompanied by a diverse group of companions, the hobbit embarks on a perilous journey across Middle-earth, battling evil forces and facing numerous challenges. The narrative, rich in mythology and complex themes of good versus evil, friendship, and heroism, has had a profound influence on the fantasy genre.","Adventure, epic, Fantasy, Fiction, High Fantasy, Historical fiction, Speculative Fiction","corruption, Courage, Despair, Destiny, Friendship, Good vs Evil, Loyalty, Nature, Power, Sacrifice",Fiction
Loving,Henry Green,1945,https://images.thegreatestbooks.org/k1jk7p435ru859mo2hlaktx5c6dl,"""Loving"" is a novel set in an Irish castle during World War II, focusing on the lives of the servants who work there. The narrative provides a detailed and intimate exploration of the relationships, gossip, and everyday routines of the domestic staff, while the war remains a distant threat. The book is known for its unique use of language and dialogue, as well as its exploration of class dynamics.","Absurdist, Allegorical, Drama, Fiction, Literary Fiction, Modernist","class, Deception, Infidelity, Love, Marriage, relationships, Servants, Social Hierarchy, Unknown",Fiction
Lucky Jim,Kingsley Amis,1954,https://images.thegreatestbooks.org/l9fl5toyy92x9dt1800e7nj8e82l,"""Lucky Jim"" is a comic novel that follows the life of Jim Dixon, a young and disillusioned lecturer at a provincial British university. Struggling with his job and his pretentious boss, Dixon navigates through a series of humorous and often absurd situations, including a disastrous public lecture and a chaotic weekend at his boss's house. The novel satirizes the snobbishness and hypocrisy of the academic world, and explores themes of class, ambition, and the struggle to find personal authenticity in a conformist society.","Fiction, Humor, Literary Fiction, Picaresque, Satire, Social & Cultural Fiction","Academia, academic, Alcohol, Career, relationships, Social Class",Fiction
The Man Who Loved Children,Christina Stead,1940,https://images.thegreatestbooks.org/bxdatwlnzqc9b46redhr0qnsqock,"This novel explores the complex dynamics of the Pollit family, focusing on the relationship between the egotistical patriarch Sam and his idealistic daughter Louie. Set in Washington D.C. during the 1930s, the story provides a stark portrayal of a dysfunctional family, where Sam's delusional optimism and insensitivity clash with Louie's growing disillusionment and rebellion. The narrative delves into themes of family conflict, emotional abuse, and the struggle for individual identity within the confines of family expectations.","Family & Relationships, Fiction, Literary Fiction, Modernist, Social & Cultural Fiction, Tragedy","childhood, conflict, Family, Family dynamics, isolation, Marriage, Mental Health, Mothers & Children, Parenting, Power Dynamics, relationships, Siblings, Women's Studies",Fiction
Midnight's Children,Salman Rushdie,1981,https://images.thegreatestbooks.org/zq4b1zjsq6od7io356qmlflrs6bz,"The novel tells the story of Saleem Sinai, who was born at the exact moment when India gained its independence. As a result, he shares a mystical connection with other children born at the same time, all of whom possess unique, magical abilities. As Saleem grows up, his life mirrors the political and cultural changes happening in his country, from the partition of India and Pakistan, to the Bangladesh War of Independence. The story is a blend of historical fiction and magical realism, exploring themes of identity, fate, and the power of storytelling.","Allegorical, Fiction, Historical fiction, Literary Fiction, Magical Realism, Postmodern, Social & Cultural Fiction","Asian History, conflict, Destiny, Family, History, Magic, Memory, Nostalgia, Partition, Politics, Power, Revolution",Fiction
Money,Martin Amis,1984,https://images.thegreatestbooks.org/sxlgi29jszwxrf2c25c9uep91tfr,"""Money"" is a darkly humorous novel that follows the life of John Self, a hedonistic, self-destructive director of commercials, as he navigates the excesses and depravities of 1980s New York and London. His life is filled with overindulgence in food, alcohol, drugs, and women, leading to a downward spiral of self-destruction. The novel is a satire on the excesses of capitalism and the obsession with wealth and materialism, and it also explores themes of identity, self-loathing, and the destructive power of addiction.","Absurdist, Dark Humor, Fiction, Literary Fiction, Picaresque, Postmodern","Addiction, Capitalism, consumerism, Excess, Film Industry, greed, self-destruction",Fiction
The Moviegoer,Walker Percy,1961,https://images.thegreatestbooks.org/e8hrj5md5ufvsvtof9h8saskmtie,"The protagonist, a young stockbroker in New Orleans, is alienated, detached, and finds more reality in movies and books than in his everyday life. He searches for meaning in life, often through his relationships with his aunt and his cousin, while also dealing with existential dread and the impending reality of turning 30. This exploration of alienation and search for identity in the modern world won the National Book Award for Fiction.","Allegorical, Fiction, Literary Fiction, philosophical, Postmodern, Social & Cultural Fiction","Alienation, Existentialism, Family, Mental Health, Movies, Psychology & Mental Health, relationships, Search for Meaning, Southern Gothic",Fiction
Mrs. Dalloway,Virginia Woolf,1925,https://images.thegreatestbooks.org/bfr0xm2ihbzmzyquqo7j2x5g2do4,"The novel chronicles a day in the life of Clarissa Dalloway, a high-society woman in post-World War I England, as she prepares for a party she is hosting that evening. Throughout the day, she encounters various characters from her past, including a former suitor and a shell-shocked war veteran. The narrative jumps back and forth in time and in and out of different characters' minds, exploring themes of mental illness, existentialism, and the nature of time.","Drama, Fiction, Literary Fiction, Modernist, Psychological, Social & Cultural Fiction","class, Death, Friendship, Love, Marriage, Memory, Mental illness, Society, Time, War, Women's Studies",Fiction
Naked Lunch,William S. Burroughs,1959,https://images.thegreatestbooks.org/tepkrjucrera9m8cja2wmu897n1g,"A controversial novel that explores the dark depths of drug addiction and societal decay, following the protagonist, a junkie, as he navigates through a series of surreal and grotesque scenarios. The narrative is nonlinear and disjointed, reflecting the protagonist's fragmented consciousness and the chaotic nature of addiction. The book is known for its graphic depictions of sex, violence, and drug use, and it challenges traditional notions of morality and narrative structure.","Absurdist, Banned books, Experimental, Fiction, Picaresque, Postmodern, Social & Cultural Fiction","Addiction, Alienation, Control, corruption, Freedom, Identity, Madness, Paranoia",Fiction
Native Son,Richard Wright,1940,https://images.thegreatestbooks.org/l545dbjxpniesoyf6snk3w5e41ks,"This novel tells the story of Bigger Thomas, a young African-American man living in Chicago's South Side during the 1930s. Bigger's life takes a tragic turn when he accidentally kills a young white woman. The incident leads to his arrest and trial, revealing the deep-seated racial prejudices and injustices prevalent in American society at the time. The narrative explores themes of poverty, systemic racism, fear, and the effects of oppression.","Fiction, Literary Fiction, Political, Psychological, Social & Cultural Fiction, Tragedy","Alienation, fear, History, Identity, Justice, oppression, Poverty, Racism, Violence",Fiction
Neuromancer,William Gibson,1984,https://images.thegreatestbooks.org/s2gnbe0wxy3zst8ejh897yi323rz,"In this groundbreaking cyberpunk novel, a washed-up computer hacker is hired by a mysterious employer to pull off the ultimate hack. As he navigates a dystopian future filled with artificial intelligence, corporate espionage, and virtual reality, he must confront his own past and the dark realities of the digital world. The narrative explores themes of technology, identity, and consciousness, pushing the boundaries of science fiction literature.","Cyberpunk, Fiction, Hard Science Fiction, Modernist, Postmodern, Science fiction, Speculative Fiction","Artificial Intelligence, corporate espionage, Cybernetics, Drugs, Hacking, surveillance, Technology, Virtual reality",Fiction
Never Let Me Go,Kazuo Ishiguro,2005,https://images.thegreatestbooks.org/ujq27upkttoe69pzq6b35hd1wqpk,"The novel is a haunting tale of three friends, who grow up together at a seemingly idyllic English boarding school. As they mature, they discover a dark secret about their school and the purpose of their existence, which is to become organ donors for the rest of society. The story is a profound exploration of what it means to be human, the morality of scientific innovation, and the heartbreaking reality of love and loss.","Drama, Fiction, Literary Fiction, Psychological, Science fiction, Social & Cultural Fiction, Speculative Fiction, Travel","Cloning, Education, Ethics, Friendship, health, Humanity, Memory, Mortality",Fiction
Nineteen Eighty Four,George Orwell,1949,https://images.thegreatestbooks.org/oka7y4u1r23osldhnx42q9lvxtpz,"Set in a dystopian future, the novel presents a society under the total control of a totalitarian regime, led by the omnipresent Big Brother. The protagonist, a low-ranking member of 'the Party', begins to question the regime and falls in love with a woman, an act of rebellion in a world where independent thought, dissent, and love are prohibited. The novel explores themes of surveillance, censorship, and the manipulation of truth.","Dystopian, Fiction, Political, Satire, Science fiction, Speculative Fiction","Control, fear, Freedom, Identity, Language & Writing, Political Ideologies, Propaganda, rebellion, surveillance",Fiction
On the Road,Jack Kerouac,1957,https://images.thegreatestbooks.org/fg7dcdho70lia2gqjixk6oiq7pme,"This novel follows the story of a young man and his friend as they embark on a series of cross-country road trips across America during the late 1940s and early 1950s. The protagonist, driven by a desire for freedom and a quest for identity, encounters a series of eccentric characters and experiences the highs and lows of the Beat Generation. The narrative is a testament to the restlessness of youth and the allure of adventure, underscored by themes of jazz, poetry, and drug use.","Allegorical, Drama, Fiction, Literary Fiction, Social & Cultural Fiction, Travel","Beat Generation, Counterculture, Freedom, Friendship, History, Jazz, Self-discovery",Fiction
